{
  "schema_version": "0.1",
  "report_id": "demo-2026-02-18-IST-002",
  "as_of_timestamp": 1771357600,
  "custodian": { "name": "Demo Custodian", "location": "Istanbul/TR" },
  "bars": [
    {
      "serial_no": "CDEF-3456",
      "refiner": "ACME",
      "gross_weight_g": 1000,
      "fineness": "999.9",
      "fine_weight_g": 1000,
      "vault_id": "IST-VAULT-01",
      "allocation_status": "allocated"
    }
  ],
  "totals": { "fine_gold_grams": 1000, "bars_count": 1 }
}
