{
  "schema_version": "0.1",
  "report_id": "demo-2026-02-18-IST-001",
  "as_of_timestamp": 1771357527,
  "custodian": {
    "name": "Demo Custodian",
    "location": "Istanbul/TR"
  },
  "bars": [
    {
      "serial_no": "ABCD-1234",
      "refiner": "ACME",
      "gross_weight_g": 1001,
      "fineness": "999.9",
      "fine_weight_g": 1000,
      "vault_id": "IST-VAULT-01",
      "allocation_status": "allocated"
    },
    {
      "serial_no": "BCDE-2345",
      "refiner": "ACME",
      "gross_weight_g": 1000,
      "fineness": "999.9",
      "fine_weight_g": 999,
      "vault_id": "IST-VAULT-01",
      "allocation_status": "allocated"
    }
  ],
  "totals": {
    "fine_gold_grams": 1999,
    "bars_count": 2
  }
}
